results/5.Full Feature Final Modeling/Hyp Tuned/csv/full_feature_before_after_tuning_comparison.csv

feature_set,model_key,model,raw_features_before_tuning,encoded_features_before_tuning,fit_seconds_before_tuning,model_path_before_tuning,split,accuracy_before_tuning,balanced_accuracy_before_tuning,macro_f1_before_tuning,macro_precision_before_tuning,macro_recall_before_tuning,log_loss_before_tuning,raw_features_after_tuning,encoded_features_after_tuning,best_params,fit_seconds_after_tuning,model_path_after_tuning,accuracy_after_tuning,balanced_accuracy_after_tuning,macro_f1_after_tuning,macro_precision_after_tuning,macro_recall_after_tuning,log_loss_after_tuning,accuracy_change_after_minus_before,balanced_accuracy_change_after_minus_before,macro_f1_change_after_minus_before,macro_precision_change_after_minus_before,macro_recall_change_after_minus_before,log_loss_change_after_minus_before
full,catboost,CatBoost,36,244,1.887336015701294,results\5.Full Feature Final Modeling\models\full__catboost.pkl,test,0.755656108597285,0.7634487621438072,0.669834367963829,0.6887787064532277,0.6623675266560126,0.5595298050406284,36,244,"{""iterations"": 500, ""learning_rate"": 0.1, ""depth"": 6, ""l2_leaf_reg"": 1}",1.7716255187988281,results\5.Full Feature Final Modeling\Hyp Tuned\models\full__catboost.pkl,0.7737556561085973,0.7818837021983369,0.7009593182413293,0.7249596790831768,0.6905068265906414,0.5627290532172686,0.018099547511312264,0.018434940054529725,0.031124950277500285,0.036180972629949126,0.028139299934628825,0.0031992481766401903
full,catboost,CatBoost,36,244,1.887336015701294,results\5.Full Feature Final Modeling\models\full__catboost.pkl,train,0.8685824991927672,0.867773469619976,0.8317163919841616,0.8648558743447851,0.8123675091793533,0.38633145580396505,36,244,"{""iterations"": 500, ""learning_rate"": 0.1, ""depth"": 6, ""l2_leaf_reg"": 1}",1.7716255187988281,results\5.Full Feature Final Modeling\Hyp Tuned\models\full__catboost.pkl,0.9641588634162093,0.9620870312726497,0.9580513105614274,0.9717998000419307,0.946627406610924,0.20474768468454524,0.09557636422344207,0.09431356165267368,0.12633491857726586,0.10694392569714561,0.13425989743157074,-0.1815837711194198
full,catboost,CatBoost,36,244,1.887336015701294,results\5.Full Feature Final Modeling\models\full__catboost.pkl,validation,0.7581920903954802,0.7633219911397745,0.6730406887153002,0.6999168373200546,0.6635204426899101,0.5783581739189271,36,244,"{""iterations"": 500, ""learning_rate"": 0.1, ""depth"": 6, ""l2_leaf_reg"": 1}",1.7716255187988281,results\5.Full Feature Final Modeling\Hyp Tuned\models\full__catboost.pkl,0.7661016949152543,0.7748237445796714,0.6904015403843702,0.7123679566060318,0.6803769055609733,0.5882719777681287,0.007909604519774072,0.0115017534398969,0.017360851669069977,0.012451119285977197,0.016856462871063238,0.009913803849201597
full,decision_tree,Decision Tree,36,244,0.01723313331604004,results\5.Full Feature Final Modeling\models\full__decision_tree.pkl,test,0.6787330316742082,0.7432249476019895,0.6372490662931839,0.6410186854399066,0.6450392025098641,2.0030100348578386,36,244,"{""max_depth"": 8, ""min_samples_leaf"": 20, ""criterion"": ""entropy""}",0.03162670135498047,results\5.Full Feature Final Modeling\Hyp Tuned\models\full__decision_tree.pkl,0.7058823529411765,0.762326463040227,0.6649331794204171,0.670157614060053,0.6708845969645315,1.4324466634606323,0.02714932126696834,0.01910151543823746,0.02768411312723318,0.029138928620146443,0.02584539445466738,-0.5705633713972063
full,decision_tree,Decision Tree,36,244,0.01723313331604004,results\5.Full Feature Final Modeling\models\full__decision_tree.pkl,train,0.7717145624798192,0.8300445107440124,0.7468190395681097,0.7463972665944397,0.7693413693314172,0.5273452343302723,36,244,"{""max_depth"": 8, ""min_samples_leaf"": 20, ""criterion"": ""entropy""}",0.03162670135498047,results\5.Full Feature Final Modeling\Hyp Tuned\models\full__decision_tree.pkl,0.7594446238295124,0.8136175033335128,0.7291208653200262,0.7364618059121657,0.7445904364613778,0.5494776922602538,-0.012269938650306789,-0.016427007410499628,-0.01769817424808351,-0.009935460682274022,-0.024750932870039377,0.02213245792998153
full,decision_tree,Decision Tree,36,244,0.01723313331604004,results\5.Full Feature Final Modeling\models\full__decision_tree.pkl,validation,0.6700564971751413,0.7418466825869549,0.6343317914293861,0.6437101497527242,0.6441249019487597,1.5414145980724454,36,244,"{""max_depth"": 8, ""min_samples_leaf"": 20, ""criterion"": ""entropy""}",0.03162670135498047,results\5.Full Feature Final Modeling\Hyp Tuned\models\full__decision_tree.pkl,0.696045197740113,0.7629072567180004,0.6625505980006802,0.6817470664834281,0.6732985445996028,1.3488309837182897,0.025988700564971712,0.021060574131045562,0.028218806571294053,0.03803691673070386,0.0291736426508431,-0.19258361435415572
full,lightgbm,LightGBM,36,244,1.1827988624572754,results\5.Full Feature Final Modeling\models\full__lightgbm.pkl,test,0.748868778280543,0.7655090699658063,0.6735742981035222,0.6849144301169887,0.6676542251773236,0.7484601072242771,36,244,"{""n_estimators"": 300, ""learning_rate"": 0.03, ""num_leaves"": 15, ""max_depth"": 8}",0.34535813331604004,results\5.Full Feature Final Modeling\Hyp Tuned\models\full__lightgbm.pkl,0.744343891402715,0.7891688981910626,0.7015710531241525,0.7009389809122787,0.707370077232588,0.5901807581686223,-0.004524886877828038,0.023659828225256363,0.02799675502063026,0.01602455079528997,0.0397158520552644,-0.15827934905565488
full,lightgbm,LightGBM,36,244,1.1827988624572754,results\5.Full Feature Final Modeling\models\full__lightgbm.pkl,train,1.0,1.0,1.0,1.0,1.0,0.018579760318756435,36,244,"{""n_estimators"": 300, ""learning_rate"": 0.03, ""num_leaves"": 15, ""max_depth"": 8}",0.34535813331604004,results\5.Full Feature Final Modeling\Hyp Tuned\models\full__lightgbm.pkl,0.903777849531805,0.9275008189635038,0.889102151650946,0.8830967520577326,0.9026693944499208,0.32204964695455596,-0.09622215046819504,-0.07249918103649622,-0.11089784834905403,-0.11690324794226736,-0.09733060555007922,0.30346988663579955
full,lightgbm,LightGBM,36,244,1.1827988624572754,results\5.Full Feature Final Modeling\models\full__lightgbm.pkl,validation,0.7559322033898305,0.7800456582469177,0.69600396008163,0.7057202988925146,0.6904510149965121,0.7332687503681004,36,244,"{""n_estimators"": 300, ""learning_rate"": 0.03, ""num_leaves"": 15, ""max_depth"": 8}",0.34535813331604004,results\5.Full Feature Final Modeling\Hyp Tuned\models\full__lightgbm.pkl,0.7548022598870057,0.7957154805254403,0.7088313762250511,0.712931140675043,0.7139416605307399,0.5962953739234126,-0.001129943502824804,0.01566982227852254,0.012827416143421089,0.007210841782528399,0.02349064553422786,-0.13697337644468777
full,mlp,Neural Network / MLP,36,244,0.3411540985107422,results\5.Full Feature Final Modeling\models\full__mlp.pkl,test,0.7579185520361991,0.7717860526857098,0.6825686867730173,0.695923378790899,0.6755593991234191,0.5801715468731193,36,244,"{""hidden_layer_sizes"": [128, 64], ""activation"": ""tanh"", ""alpha"": 0.0001, ""learning_rate_init"": 0.001}",0.5118467807769775,results\5.Full Feature Final Modeling\Hyp Tuned\models\full__mlp.pkl,0.7737556561085973,0.7804370266550795,0.6967706849689801,0.7229253012156102,0.6876019659204248,0.5466177174329,0.015837104072398245,0.008650973969369757,0.014201998195962795,0.02700192242471111,0.01204256679700566,-0.03355382944021934
full,mlp,Neural Network / MLP,36,244,0.3411540985107422,results\5.Full Feature Final Modeling\models\full__mlp.pkl,train,0.8656764610913787,0.8721446339402812,0.8312599382850713,0.8475995798474615,0.8193598147933446,0.3648251569014693,36,244,"{""hidden_layer_sizes"": [128, 64], ""activation"": ""tanh"", ""alpha"": 0.0001, ""learning_rate_init"": 0.001}",0.5118467807769775,results\5.Full Feature Final Modeling\Hyp Tuned\models\full__mlp.pkl,0.8333871488537294,0.8382166531970662,0.7835361914335053,0.8081451007827626,0.7697568162583964,0.43241554684252376,-0.032289312237649304,-0.033927980743215014,-0.047723746851565996,-0.0394544790646989,-0.049602998534948206,0.06759038994105443
full,mlp,Neural Network / MLP,36,244,0.3411540985107422,results\5.Full Feature Final Modeling\models\full__mlp.pkl,validation,0.7649717514124293,0.781485206623492,0.7000699540822385,0.7141923107039386,0.6917033519595618,0.5961476344188066,36,244,"{""hidden_layer_sizes"": [128, 64], ""activation"": ""tanh"", ""alpha"": 0.0001, ""learning_rate_init"": 0.001}",0.5118467807769775,results\5.Full Feature Final Modeling\Hyp Tuned\models\full__mlp.pkl,0.7751412429378531,0.7860316178487574,0.706181754177695,0.7253678046370132,0.6965616230751995,0.5941247566819388,0.01016949152542379,0.004546411225265445,0.006111800095456532,0.011175493933074598,0.004858271115637747,-0.002022877736867823
full,random_forest,Random Forest,36,244,0.49912166595458984,results\5.Full Feature Final Modeling\models\full__random_forest.pkl,test,0.753393665158371,0.7827854495865848,0.6979599241356652,0.7022161830368193,0.6952645863534878,0.6334910119925868,36,244,"{""n_estimators"": 300, ""max_depth"": 18, ""min_samples_leaf"": 2, ""max_features"": ""sqrt""}",0.3516111373901367,results\5.Full Feature Final Modeling\Hyp Tuned\models\full__random_forest.pkl,0.746606334841629,0.7848859133728943,0.6968003575699285,0.6976284584980238,0.6988730404459328,0.6386898373334207,-0.006787330316742057,0.002100463786309459,-0.0011595665657366805,-0.0045877245387955234,0.003608454092445035,0.005198825340833824
full,random_forest,Random Forest,36,244,0.49912166595458984,results\5.Full Feature Final Modeling\models\full__random_forest.pkl,train,0.9606070390700678,0.970713140007971,0.9603172812244108,0.9579448003555194,0.9632215884738562,0.3471903801937341,36,244,"{""n_estimators"": 300, ""max_depth"": 18, ""min_samples_leaf"": 2, ""max_features"": ""sqrt""}",0.3516111373901367,results\5.Full Feature Final Modeling\Hyp Tuned\models\full__random_forest.pkl,0.9425250242169841,0.9580280236262935,0.9379653038899898,0.9325668888545521,0.9461749456032695,0.3728352125117553,-0.018082014853083694,-0.012685116381677575,-0.02235197733442107,-0.025377911500967354,-0.01704664287058666,0.02564483231802117
full,random_forest,Random Forest,36,244,0.49912166595458984,results\5.Full Feature Final Modeling\models\full__random_forest.pkl,validation,0.7378531073446327,0.7722887653394914,0.6825182537071215,0.6900131462084778,0.680816875221371,0.6414910526270297,36,244,"{""n_estimators"": 300, ""max_depth"": 18, ""min_samples_leaf"": 2, ""max_features"": ""sqrt""}",0.3516111373901367,results\5.Full Feature Final Modeling\Hyp Tuned\models\full__random_forest.pkl,0.7412429378531074,0.7794103074419861,0.6907652090325316,0.6984196273603646,0.6916362141659542,0.645593752911564,0.003389830508474634,0.007121542102494716,0.008246955325410088,0.008406481151886802,0.010819338944583201,0.0041027002845343
full,rbf_svm,RBF SVM,36,244,1.914433479309082,results\5.Full Feature Final Modeling\models\full__rbf_svm.pkl,test,0.7375565610859729,0.7821151350862339,0.693542080183887,0.6991128715954239,0.6978104570681626,0.5582807842748673,36,244,"{""C"": 10.0, ""gamma"": 0.01}",1.4845466613769531,results\5.Full Feature Final Modeling\Hyp Tuned\models\full__rbf_svm.pkl,0.748868778280543,0.7844375753803069,0.6976031074868284,0.7025585294279807,0.6978639694285768,0.5394429783977055,0.011312217194570096,0.002322440294073025,0.0040610273029414445,0.003445657832556792,5.3512360414176285e-05,-0.018837805877161773
full,rbf_svm,RBF SVM,36,244,1.914433479309082,results\5.Full Feature Final Modeling\models\full__rbf_svm.pkl,train,0.827252179528576,0.8636437280461712,0.7990255191028233,0.7991033210251145,0.8123631581580347,0.4118771361741661,36,244,"{""C"": 10.0, ""gamma"": 0.01}",1.4845466613769531,results\5.Full Feature Final Modeling\Hyp Tuned\models\full__rbf_svm.pkl,0.8692282854375202,0.8986819546958812,0.849193180562383,0.8456250035725695,0.8625803023387683,0.3774832183918619,0.041976105908944183,0.035038226649710014,0.050167661459559754,0.046521682547455034,0.05021714418073353,-0.03439391778230422
full,rbf_svm,RBF SVM,36,244,1.914433479309082,results\5.Full Feature Final Modeling\models\full__rbf_svm.pkl,validation,0.7197740112994351,0.7700364425521151,0.6754591752889142,0.6886291401934356,0.6801591920591155,0.6039129000312617,36,244,"{""C"": 10.0, ""gamma"": 0.01}",1.4845466613769531,results\5.Full Feature Final Modeling\Hyp Tuned\models\full__rbf_svm.pkl,0.7322033898305085,0.7799362137019884,0.6874770014067678,0.6956256298483677,0.6926504290739647,0.5900699505691793,0.012429378531073398,0.009899771149873282,0.012017826117853625,0.006996489654932159,0.012491237014849221,-0.013842949462082421
full,xgboost,XGBoost,36,244,0.8278713226318359,results\5.Full Feature Final Modeling\models\full__xgboost.pkl,test,0.753393665158371,0.7606411724579575,0.667316573787064,0.6901483529390506,0.6598263618021779,0.5598228114655144,36,244,"{""n_estimators"": 300, ""learning_rate"": 0.03, ""max_depth"": 4, ""subsample"": 0.9, ""colsample_bytree"": 0.9}",0.5864224433898926,results\5.Full Feature Final Modeling\Hyp Tuned\models\full__xgboost.pkl,0.753393665158371,0.7600287738851762,0.6667242189335211,0.6923050870419291,0.6589872395877451,0.5761801581234343,0.0,-0.0006123985727812808,-0.0005923548535429202,0.0021567341028784215,-0.0008391222144328303,0.01635734665791988
full,xgboost,XGBoost,36,244,0.8278713226318359,results\5.Full Feature Final Modeling\models\full__xgboost.pkl,train,0.9231514368743946,0.9230124807404433,0.9054231189445723,0.9242040167814741,0.8911533260471266,0.2690005150100619,36,244,"{""n_estimators"": 300, ""learning_rate"": 0.03, ""max_depth"": 4, ""subsample"": 0.9, ""colsample_bytree"": 0.9}",0.5864224433898926,results\5.Full Feature Final Modeling\Hyp Tuned\models\full__xgboost.pkl,0.8621246367452373,0.864203667855291,0.8254975214620651,0.8532484112240497,0.8080479497515186,0.3913232133886128,-0.06102680012915729,-0.05880881288515227,-0.07992559748250716,-0.07095560555742442,-0.08310537629560799,0.12232269837855092
full,xgboost,XGBoost,36,244,0.8278713226318359,results\5.Full Feature Final Modeling\models\full__xgboost.pkl,validation,0.7615819209039548,0.774434499150931,0.6910574789970273,0.7106135697388379,0.6811348277872171,0.5719418691732293,36,244,"{""n_estimators"": 300, ""learning_rate"": 0.03, ""max_depth"": 4, ""subsample"": 0.9, ""colsample_bytree"": 0.9}",0.5864224433898926,results\5.Full Feature Final Modeling\Hyp Tuned\models\full__xgboost.pkl,0.768361581920904,0.7756806712020977,0.6938043260814079,0.7206623674080483,0.682052411035075,0.574104397729352,0.006779661016949157,0.0012461720511667274,0.002746847084380555,0.010048797669210408,0.000917583247857845,0.002162528556122645

results/5.Full Feature Final Modeling/reports/full_feature_final_modeling_report.md

## Best Baseline Model

Before tuning, the best validation model was **Neural Network / MLP** with validation Macro-F1 = 0.7001, balanced accuracy = 0.7815, and log-loss = 0.5961.

## Best Tuned Model

After tuning, the best validation model was **LightGBM** with validation Macro-F1 = 0.7088, balanced accuracy = 0.7957, and log-loss = 0.5963. On the held-out test set, this same selected model reached Macro-F1 = 0.7016, balanced accuracy = 0.7892, and log-loss = 0.5902.